{
  "$schema": "./schema/peaks.schema.json",
  "version": 1,
  "elevation_datum": "metres above mean sea level (EGM96/local orthometric as published)",
  "coordinate_system": "WGS84 decimal degrees",
  "country_codes": "ISO 3166-1 alpha-2 (AQ = Antarctica)",
  "peaks": [
    {
      "id": "everest",
      "name": "Mount Everest",
      "alt_names": ["Sagarmatha", "Chomolungma", "Qomolangma"],
      "elevation_m": 8848.86,
      "prominence_m": 8848.86,
      "lat": 27.98806,
      "lon": 86.92528,
      "range": "Himalaya",
      "subrange": "Mahalangur Himal (Khumbu)",
      "country": ["NP", "CN"],
      "first_ascent": {
        "year": 1953,
        "climbers": ["Edmund Hillary", "Tenzing Norgay"]
      },
      "difficulty": "expedition_8000",
      "tags": ["eight_thousander", "seven_summits"],
      "climate_id": "khumbu",
      "routes": ["everest__south_col", "everest__north_col"],
      "confidence": "high",
      "notes": "Elevation from the 2020 joint China-Nepal survey (snow height)."
    },
    {
      "id": "k2",
      "name": "K2",
      "alt_names": ["Chhogori", "Mount Godwin-Austen", "Qogir"],
      "elevation_m": 8611,
      "prominence_m": 4017,
      "lat": 35.8825,
      "lon": 76.51333,
      "range": "Karakoram",
      "subrange": "Baltoro Muztagh",
      "country": ["PK", "CN"],
      "first_ascent": {
        "year": 1954,
        "climbers": ["Lino Lacedelli", "Achille Compagnoni"]
      },
      "difficulty": "expedition_8000",
      "tags": ["eight_thousander"],
      "climate_id": "karakoram",
      "routes": ["k2__abruzzi_spur"],
      "confidence": "high"
    },
    {
      "id": "kangchenjunga",
      "name": "Kangchenjunga",
      "alt_names": ["Kanchenjunga", "Kangchen Dzö-nga"],
      "elevation_m": 8586,
      "prominence_m": 3922,
      "lat": 27.7025,
      "lon": 88.14667,
      "range": "Himalaya",
      "subrange": "Kangchenjunga Himal",
      "country": ["NP", "IN"],
      "first_ascent": {
        "year": 1955,
        "climbers": ["Joe Brown", "George Band"]
      },
      "difficulty": "expedition_8000",
      "tags": ["eight_thousander"],
      "climate_id": "khumbu",
      "routes": [],
      "confidence": "high",
      "notes": "First ascensionists stopped a few metres short of the summit at the request of the Chogyal of Sikkim."
    },
    {
      "id": "lhotse",
      "name": "Lhotse",
      "alt_names": [],
      "elevation_m": 8516,
      "prominence_m": 610,
      "lat": 27.96167,
      "lon": 86.93333,
      "range": "Himalaya",
      "subrange": "Mahalangur Himal (Khumbu)",
      "country": ["NP", "CN"],
      "first_ascent": {
        "year": 1956,
        "climbers": ["Ernst Reiss", "Fritz Luchsinger"]
      },
      "difficulty": "expedition_8000",
      "tags": ["eight_thousander"],
      "climate_id": "khumbu",
      "routes": [],
      "confidence": "high",
      "notes": "Normal route shares the South Col route up to the Lhotse Face (C3)."
    },
    {
      "id": "makalu",
      "name": "Makalu",
      "alt_names": [],
      "elevation_m": 8485,
      "prominence_m": 2378,
      "lat": 27.88972,
      "lon": 87.08889,
      "range": "Himalaya",
      "subrange": "Mahalangur Himal (Makalu)",
      "country": ["NP", "CN"],
      "first_ascent": {
        "year": 1955,
        "climbers": ["Lionel Terray", "Jean Couzy"]
      },
      "difficulty": "expedition_8000",
      "tags": ["eight_thousander"],
      "climate_id": "khumbu",
      "routes": [],
      "confidence": "high"
    },
    {
      "id": "cho_oyu",
      "name": "Cho Oyu",
      "alt_names": [],
      "elevation_m": 8188,
      "prominence_m": 2344,
      "lat": 28.09417,
      "lon": 86.66083,
      "range": "Himalaya",
      "subrange": "Mahalangur Himal (Khumbu)",
      "country": ["NP", "CN"],
      "first_ascent": {
        "year": 1954,
        "climbers": ["Herbert Tichy", "Joseph Jöchler", "Pasang Dawa Lama"]
      },
      "difficulty": "expedition_8000",
      "tags": ["eight_thousander"],
      "climate_id": "khumbu",
      "routes": [],
      "confidence": "high"
    },
    {
      "id": "dhaulagiri",
      "name": "Dhaulagiri I",
      "alt_names": ["Dhaulagiri"],
      "elevation_m": 8167,
      "prominence_m": 3357,
      "lat": 28.69667,
      "lon": 83.49306,
      "range": "Himalaya",
      "subrange": "Dhaulagiri Himal",
      "country": ["NP"],
      "first_ascent": {
        "year": 1960,
        "climbers": ["Kurt Diemberger", "Peter Diener", "Ernst Forrer", "Albin Schelbert", "Nawang Dorje", "Nima Dorje"]
      },
      "difficulty": "expedition_8000",
      "tags": ["eight_thousander"],
      "climate_id": "khumbu",
      "routes": [],
      "confidence": "high"
    },
    {
      "id": "manaslu",
      "name": "Manaslu",
      "alt_names": ["Kutang"],
      "elevation_m": 8163,
      "prominence_m": 3092,
      "lat": 28.54944,
      "lon": 84.56194,
      "range": "Himalaya",
      "subrange": "Mansiri Himal",
      "country": ["NP"],
      "first_ascent": {
        "year": 1956,
        "climbers": ["Toshio Imanishi", "Gyalzen Norbu"]
      },
      "difficulty": "expedition_8000",
      "tags": ["eight_thousander"],
      "climate_id": "khumbu",
      "routes": [],
      "confidence": "high"
    },
    {
      "id": "nanga_parbat",
      "name": "Nanga Parbat",
      "alt_names": ["Diamir"],
      "elevation_m": 8126,
      "prominence_m": 4608,
      "lat": 35.2375,
      "lon": 74.58917,
      "range": "Himalaya",
      "subrange": "Nanga Parbat Massif",
      "country": ["PK"],
      "first_ascent": {
        "year": 1953,
        "climbers": ["Hermann Buhl"]
      },
      "difficulty": "expedition_8000",
      "tags": ["eight_thousander"],
      "climate_id": "karakoram",
      "routes": [],
      "confidence": "high",
      "notes": "Western anchor of the Himalaya; climate profile borrowed from the Karakoram."
    },
    {
      "id": "annapurna",
      "name": "Annapurna I",
      "alt_names": ["Annapurna"],
      "elevation_m": 8091,
      "prominence_m": 2984,
      "lat": 28.59611,
      "lon": 83.82028,
      "range": "Himalaya",
      "subrange": "Annapurna Himal",
      "country": ["NP"],
      "first_ascent": {
        "year": 1950,
        "climbers": ["Maurice Herzog", "Louis Lachenal"]
      },
      "difficulty": "expedition_8000",
      "tags": ["eight_thousander"],
      "climate_id": "khumbu",
      "routes": [],
      "confidence": "high"
    },
    {
      "id": "gasherbrum_i",
      "name": "Gasherbrum I",
      "alt_names": ["Hidden Peak", "K5"],
      "elevation_m": 8080,
      "prominence_m": 2155,
      "lat": 35.72444,
      "lon": 76.69639,
      "range": "Karakoram",
      "subrange": "Baltoro Muztagh (Gasherbrum)",
      "country": ["PK", "CN"],
      "first_ascent": {
        "year": 1958,
        "climbers": ["Pete Schoening", "Andy Kauffman"]
      },
      "difficulty": "expedition_8000",
      "tags": ["eight_thousander"],
      "climate_id": "karakoram",
      "routes": [],
      "confidence": "high"
    },
    {
      "id": "broad_peak",
      "name": "Broad Peak",
      "alt_names": ["Faichan Kangri", "K3"],
      "elevation_m": 8051,
      "prominence_m": 1701,
      "lat": 35.81056,
      "lon": 76.56833,
      "range": "Karakoram",
      "subrange": "Baltoro Muztagh",
      "country": ["PK", "CN"],
      "first_ascent": {
        "year": 1957,
        "climbers": ["Marcus Schmuck", "Fritz Wintersteller", "Kurt Diemberger", "Hermann Buhl"]
      },
      "difficulty": "expedition_8000",
      "tags": ["eight_thousander"],
      "climate_id": "karakoram",
      "routes": [],
      "confidence": "high",
      "notes": "Main summit 8051 m; the fore-summit (~8030 m) is a frequent false finish."
    },
    {
      "id": "gasherbrum_ii",
      "name": "Gasherbrum II",
      "alt_names": ["K4"],
      "elevation_m": 8035,
      "prominence_m": 1524,
      "lat": 35.75778,
      "lon": 76.65333,
      "range": "Karakoram",
      "subrange": "Baltoro Muztagh (Gasherbrum)",
      "country": ["PK", "CN"],
      "first_ascent": {
        "year": 1956,
        "climbers": ["Fritz Moravec", "Josef Larch", "Hans Willenpart"]
      },
      "difficulty": "expedition_8000",
      "tags": ["eight_thousander"],
      "climate_id": "karakoram",
      "routes": [],
      "confidence": "high"
    },
    {
      "id": "shishapangma",
      "name": "Shishapangma",
      "alt_names": ["Gosainthan", "Xixabangma"],
      "elevation_m": 8027,
      "prominence_m": 2897,
      "lat": 28.35222,
      "lon": 85.77972,
      "range": "Himalaya",
      "subrange": "Jugal Himal",
      "country": ["CN"],
      "first_ascent": {
        "year": 1964,
        "climbers": [
          "Xu Jing",
          "Zhang Junyan",
          "Wang Fuzhou",
          "Wu Zongyue",
          "Chen San",
          "Cheng Tianliang",
          "Migmar Trashi",
          "Doje",
          "Yonten",
          "Sodnam Doji"
        ]
      },
      "difficulty": "expedition_8000",
      "tags": ["eight_thousander"],
      "climate_id": "khumbu",
      "routes": [],
      "confidence": "medium",
      "uncertain_fields": ["first_ascent.climbers"],
      "notes": "Central summit (~8008 m) is often mistaken for the main summit."
    },
    {
      "id": "aconcagua",
      "name": "Aconcagua",
      "alt_names": ["Cerro Aconcagua"],
      "elevation_m": 6961,
      "prominence_m": 6961,
      "lat": -32.65306,
      "lon": -70.01167,
      "range": "Andes",
      "subrange": "Cordillera Principal",
      "country": ["AR"],
      "first_ascent": {
        "year": 1897,
        "climbers": ["Matthias Zurbriggen"]
      },
      "difficulty": "expedition",
      "tags": ["seven_summits"],
      "climate_id": "central_andes",
      "routes": ["aconcagua__normal"],
      "confidence": "high",
      "notes": "Elevation per 2012 survey (6960.8 m); 6962 m also cited."
    },
    {
      "id": "denali",
      "name": "Denali",
      "alt_names": ["Mount McKinley"],